{
  "artifacts": [
    {
      "file": "9b39713b30dc25b5f8b8489c77153c1c356934af92e4a0a900736a7086b7b6c5.tflite",
      "sha256": "4039920c3922c74f564a06f46fdaca3cca7be81f3b367992424585f20f776b4a",
      "size_mb": 4.032
    }
  ],
  "benchmarks": [],
  "browser": {
    "backends": [
      {
        "backend": "wasm_xnnpack",
        "date": "2026-08-11",
        "env": {
          "browser": "chromium",
          "browser_version": "151.0.7922.34",
          "headless": true,
          "jspi": true,
          "litertjs_core_version": "2.5.3",
          "machine_label": "mac-studio-m4-max",
          "os": "macOS",
          "os_version": "27.0.0",
          "webgpu_adapter": {
            "architecture": "metal-3",
            "description": "",
            "device": "",
            "vendor": "apple"
          }
        },
        "full_delegation": null,
        "latency_p50_ms": 9213.145,
        "loads": true,
        "max_rel_diff": null,
        "output_match": null,
        "provenance": "measured",
        "runs": true
      },
      {
        "backend": "webgpu_mldrift",
        "date": "2026-08-11",
        "env": {
          "browser": "chromium",
          "browser_version": "151.0.7922.34",
          "headless": true,
          "jspi": true,
          "litertjs_core_version": "2.5.3",
          "machine_label": "mac-studio-m4-max",
          "os": "macOS",
          "os_version": "27.0.0",
          "webgpu_adapter": {
            "architecture": "metal-3",
            "description": "",
            "device": "",
            "vendor": "apple"
          }
        },
        "full_delegation": true,
        "latency_p50_ms": 114.805,
        "loads": true,
        "max_rel_diff": 9978.921126760564,
        "output_match": false,
        "provenance": "measured",
        "runs": true
      }
    ],
    "demo_url": null,
    "sweep_source": "data/sweep/2.5.3/2026-08-11/cmgan.json"
  },
  "conversion": {
    "command": "python cmgan/scripts/build_cmgan.py",
    "quantization": "fp16",
    "tool": "litert-torch",
    "tool_version": "0.10.0 (editable dev checkout 115a136 + local patches)"
  },
  "cross_runtime": [],
  "delegation": null,
  "device": {
    "records": [
      {
        "device": "galaxy-s26",
        "run": {
          "accelerator": "gpu_mldrift",
          "context_length": null,
          "date": "2026-08-26",
          "decode_tokens_per_s": null,
          "delegated_ops": null,
          "env": {
            "device": "Galaxy S26 (SM-S942Q)",
            "machine_label": "galaxy-s26-npubench",
            "os_build": "Android 16",
            "runtime": "litert",
            "runtime_version": "2.2.0",
            "soc": "Qualcomm SM8850",
            "vendor_sdk": null
          },
          "error": null,
          "evidence": [
            "npubench sweep row: N=50 median, 1 backend = 1 process, accepted only with thermal NONE->NONE; NPU rows additionally required qnn_partition delegate evidence in logcat (a stock model asked for on the NPU can silently land on XNNPACK and report a CPU number)",
            "mode=jit thermal=NONE->NONE headroom=0.65999997->0.81999993 attempt=0"
          ],
          "failure_class": null,
          "full_delegation": null,
          "latency_p50_ms": 376.162,
          "loads": true,
          "max_abs_diff": null,
          "max_rel_diff": null,
          "metrics": {
            "iterations": 50,
            "latency_max_ms": 391.3,
            "latency_min_ms": 372.425,
            "load_ms": 2093.6
          },
          "output_match": null,
          "peak_mem_mb": null,
          "prefill_tokens_per_s": null,
          "provenance": "measured",
          "runs": true,
          "total_ops": null,
          "ttft_ms": null
        },
        "source": "data/device_runs/2.2.0/2026-08-26/cmgan__galaxy-s26.json"
      },
      {
        "device": "galaxy-s26",
        "run": {
          "accelerator": "npu_qnn",
          "context_length": null,
          "date": "2026-08-25",
          "decode_tokens_per_s": null,
          "delegated_ops": null,
          "env": {
            "device": "Galaxy S26 (SM-S942Q)",
            "machine_label": "galaxy-s26-npubench",
            "os_build": "Android 16",
            "runtime": "litert",
            "runtime_version": "2.2.0",
            "soc": "Qualcomm SM8850",
            "vendor_sdk": "QAIRT (Hexagon, JIT on-device)"
          },
          "error": "process_crashed (likely OOM)",
          "evidence": [
            "process_crashed (likely OOM)"
          ],
          "failure_class": "process_crashed",
          "full_delegation": null,
          "latency_p50_ms": null,
          "loads": false,
          "max_abs_diff": null,
          "max_rel_diff": null,
          "output_match": null,
          "peak_mem_mb": null,
          "prefill_tokens_per_s": null,
          "provenance": "measured",
          "runs": false,
          "total_ops": null,
          "ttft_ms": null
        },
        "source": "data/device_runs/2.2.0/2026-08-26/cmgan__galaxy-s26.json"
      },
      {
        "device": "raspberry-pi-5",
        "run": {
          "accelerator": "cpu_xnnpack",
          "context_length": null,
          "date": "2026-08-31",
          "decode_tokens_per_s": null,
          "delegated_ops": null,
          "env": {
            "device": "Raspberry Pi 5 Model B Rev 1.1",
            "machine_label": "raspberry-pi-5",
            "os_build": "Linux-6.18.34+rpt-rpi-2712-aarch64-with-glibc2.41",
            "runtime": "litert",
            "runtime_version": "2.2.0.dev20260804",
            "soc": null,
            "vendor_sdk": null
          },
          "error": null,
          "evidence": [
            "pi5 sweep row: LiteRT benchmark_model, CPU/XNNPACK at --num_threads=4, 3 invocations per file of 10 warm-up + 50 timed runs (the tool caps a phase at 150 s, so very slow graphs run fewer); latency = median of the three per-invocation medians over the timed phase; a row counts as measured only when every invocation exited 0 with XNNPACK engaged and vcgencmd get_throttled 0x0 before and after",
            "versions: ai-edge-litert-nightly=2.2.0.dev20260804, benchmark_model_sha256=babc9275addd8612caf0842294cb5b3f301c3cce46e6c5979cd2803f215f6bee, cpu=Raspberry Pi 5 Model B Rev 1.1, litert-cli-nightly=0.2.0.dev20260805, platform=Linux-6.18.34+rpt-rpi-2712-aarch64-with-glibc2.41, python=3.13.5",
            "invocation 0: exit=0 wall_s=233.4 temp 49.9->60.9C throttled=0x0 xnnpack=True median_us=7768922.0 runs=20 footprint_peak_mb=946.09",
            "invocation 1: exit=0 wall_s=232.0 temp 51.0->60.9C throttled=0x0 xnnpack=True median_us=7723225.0 runs=20 footprint_peak_mb=946.09",
            "invocation 2: exit=0 wall_s=233.5 temp 51.6->60.4C throttled=0x0 xnnpack=True median_us=7770761.0 runs=20 footprint_peak_mb=946.09"
          ],
          "failure_class": null,
          "full_delegation": null,
          "latency_p50_ms": 7768.922,
          "loads": true,
          "max_abs_diff": null,
          "max_rel_diff": null,
          "metrics": {
            "init_ms": 48.453,
            "invocations": 3,
            "iterations": 60,
            "latency_max_ms": 7823.809,
            "latency_min_ms": 7712.777,
            "threads": 4,
            "warmup_runs_per_invocation": 10
          },
          "output_match": null,
          "peak_mem_mb": 946.09,
          "prefill_tokens_per_s": null,
          "provenance": "measured",
          "runs": true,
          "total_ops": null,
          "ttft_ms": null
        },
        "source": "data/device_runs/2.2.0.dev20260804/2026-08-31/cmgan__raspberry-pi-5.json"
      }
    ]
  },
  "model": {
    "family": "cmgan",
    "id": "cmgan",
    "license": "mit",
    "source_url": "https://huggingface.co/litert-community/CMGAN-LiteRT",
    "task": "audio-to-audio"
  },
  "pitfalls": [
    "The STFT + mag^0.3 compression run in-graph; the caller must reflect-pad the input and do un-compression, iSTFT and overlap-add on the host (HF card / zoo README L1329-1333)."
  ],
  "schema_version": "1.2"
}
