{
  "artifacts": [
    {
      "file": "codec_decoder_int8_T128.tflite",
      "sha256": "8f7bb7d518bf77e33c3a729aeae55d96b79c592b465b60bd9f78f0143619d80b",
      "size_mb": 126.295
    }
  ],
  "benchmarks": [],
  "browser": {
    "backends": [
      {
        "backend": "wasm_xnnpack",
        "date": "2026-09-28",
        "env": {
          "browser": "chromium",
          "browser_version": "151.0.7922.34",
          "headless": true,
          "jspi": true,
          "litertjs_core_version": "2.5.3",
          "machine_label": "mac-studio-m4-max",
          "os": "macOS",
          "os_version": "27.0.0",
          "webgpu_adapter": {
            "architecture": "metal-3",
            "description": "",
            "device": "",
            "vendor": "apple"
          }
        },
        "full_delegation": null,
        "latency_p50_ms": null,
        "loads": true,
        "max_rel_diff": null,
        "output_match": null,
        "provenance": "measured",
        "runs": false
      },
      {
        "backend": "webgpu_mldrift",
        "date": "2026-09-28",
        "env": {
          "browser": "chromium",
          "browser_version": "151.0.7922.34",
          "headless": true,
          "jspi": true,
          "litertjs_core_version": "2.5.3",
          "machine_label": "mac-studio-m4-max",
          "os": "macOS",
          "os_version": "27.0.0",
          "webgpu_adapter": {
            "architecture": "metal-3",
            "description": "",
            "device": "",
            "vendor": "apple"
          }
        },
        "full_delegation": null,
        "latency_p50_ms": null,
        "loads": false,
        "max_rel_diff": null,
        "output_match": null,
        "provenance": "measured",
        "runs": false
      }
    ],
    "demo_url": null,
    "sweep_source": "data/sweep/2.5.3/2026-09-28/audio8-tts-preview-0.6b__codec_decoder_int8_t128.json"
  },
  "conversion": {
    "command": "T=128 SUFFIX=_g2 python export_codec_native_i8.py && python fix_native_i8_tables.py out/codec/codec_decoder_i8native_T128_g2.tflite out/codec/codec_decoder_i8nativefix_T128_g2.tflite -> python assemble_ship.py out/ship (copied as codec_decoder_int8_T128.tflite; built_from codec/codec_decoder_i8nativefix_T128_g2.tflite) (REPRODUCE entry)",
    "quantization": "export-time (PT2E DYNAMIC) int8 for all convolutions and projections, fp32 RVQ codebook tables restored after export: the converter also quantized the unannotated codebook tables asymmetrically, which TFLite's EMBEDDING_LOOKUP kernel refuses at prepare (zero_point must be 0) and set_operator_type / module split do not prevent; corr 0.998 vs fp32, WER unchanged, ja speaker cosine 0.73 (fp16 0.74); 1.6x faster than fp16 on the Mac CPU (590 vs 967 ms at T128 in the scan) — 'the CPU option' (FINDINGS §4-§5; card File table + Accuracy)",
    "tool": "litert-torch export-time PT2E dynamic int8 (export_codec_native_i8.py, the A/B partner of the post-hoc DRQ file under the house rule of 2026-07-22) + fix_native_i8_tables.py (fp32 codebooks written back into the flatbuffer); repro = hf-to-litertlm audio8_tts_work/ (REPRODUCE entry; FINDINGS §4)",
    "tool_version": "litert-torch 0.9.4 (~/venvs/lt094dev, the interpreter named in every export/quantize script's usage line: torch 2.13.0, transformers 5.14.1, ai-edge-quantizer 0.9.0, ai-edge-litert 2.2.0 — pip show 2026-09-28; REPRODUCE entry: 'env with litert-torch 0.9.4, ai-edge-litert 2.2.0, ai-edge-quantizer'); PyTorch oracle transformers 4.57.6 / torch 2.12.1 CPU fp32 in ~/parakeet-env (FINDINGS §1)"
  },
  "cross_runtime": [],
  "delegation": {
    "backend": "gpu_mldrift",
    "blocking_ops": [
      "SIN",
      "PAD",
      "TRANSPOSE_CONV",
      "TANH",
      "LOGISTIC",
      "SQUARED_DIFFERENCE",
      "DEPTHWISE_CONV_2D",
      "SLICE",
      "RESHAPE",
      "EMBEDDING_LOOKUP",
      "MAXIMUM",
      "MINIMUM"
    ],
    "coverage_ops_pct": 90.0,
    "lint_report_version": "1.1",
    "litert_version": "2.2.0",
    "matched_provenance_counts": {
      "measured": 892,
      "unmatched": 99
    },
    "partitions": 74
  },
  "model": {
    "family": "audio8-tts",
    "id": "audio8-tts-preview-0.6b__codec_decoder_int8_t128",
    "license": "apache-2.0",
    "source_url": "https://huggingface.co/litert-community/Audio8-TTS-Preview-0.6b",
    "task": "text-to-speech"
  },
  "pitfalls": [
    "CPU option only: on the Galaxy S26 GPU the int8 convolutions fail delegate kernel init ('Failed to create litert::ml_drift::DelegateKernelLiteRt: INVALID_ARGUMENT: Unable to parse bc coord for BATCH axis' — FINDINGS §4 prose; the line is not in the archived logs), so the GPU codec is the fp16 decoder (card Performance note).",
    "Post-hoc ai-edge-quantizer dynamic int8 on this decoder is not what ships: aeq's >32 MiB chunked path trips a numpy broadcast bug on the first decoder conv ([1536,1,7,1024], 44 MB); excluding that conv works (251 MB, corr 0.9984) but the native export is smaller (all convs int8) and faster at the same quality (FINDINGS §4).",
    "Same windowing rule as the fp16 T128 decoder (one call = up to 128 frames = 5.9 s; windows are not sample-exact) (card Limitations; FINDINGS §7).",
    "Sampled model: quantized graphs sample a different but valid trajectory, so per-frame agreement with the reference is not a meaningful metric; the gate is the transcript (whisper large-v3-turbo WER/CER vs the input text) and the voice (TitaNet-L speaker cosine vs the reference clip) on 14 seeded sentences (6 en + 6 ja with a cloned voice, one of each without). PyTorch reference en WER 1.1% / ja CER 0.0% / cosine 0.66 / 0.74; int8 slow + int8 fast + fp16 codec 1.1% / 0.0% / 0.68 / 0.76; int4 slow 1.1% / 0.0% / 0.63 / 0.77; int8 codec on the reference codes 1.1% / 0.0% / 0.67 / 0.73. The one English error is shared with the reference (the model drops the first word of one sentence). The fp32 graphs reproduce the reference code sequence frame for frame on all 14 sentences (card Accuracy; FINDINGS §2, §5).",
    "The graphs are driven by a host loop (audio8_tts_litert.py, Python, ai-edge-litert Interpreter, CPU): prompt construction, chunked prefill, the vendor's sampler (temperature 0.7 / top-p 0.9 / top-k 50, repetition-aware re-draw), 10 fast-AR calls per frame, windowed codec decode, voice registration; on a phone the same graphs run from Kotlin/C++ through the CompiledModel API — no on-device functional run exists yet, the Galaxy S26 rows are per-graph benchmark_model latency + delegate coverage, functional parity is Mac-only on the same files (card Files + Performance; FINDINGS §8).",
    "Prompt length + generated frames must stay under 2,048 positions (the model's max_seq_len = the KV cache); the default cap is 512 frames (about 24 s) per call (card Limitations).",
    "GQA on the KV cache must not be expressed as repeat_interleave: it lowers to BROADCAST_TO (48 per step) and made decode 615 ms/step on the Mac (thread-count independent); folding the 7 query heads that share a kv head into the matmul row dimension removed it (16 ms/step fp32). RoPE: the vendor applies interleaved-pair rotation with a bf16-rounded table; the port permutes the q/k rows of wqkv to the rotate-half layout with the same bf16-rounded cos/sin as fp32 constants, bit-identical to the vendor buffers (FINDINGS §2).",
    "fp16 weights give the AR graphs no speed or RAM gain on the CPU (XNNPACK unpacks them to fp32 at init), so the AR graphs ship int8/int4 and only the codec ships fp16 (FINDINGS §4).",
    "Preview checkpoint: the vendor documents limited dialect coverage and sensitivity to noisy or mis-transcribed references. Generated speech can be misused for impersonation; obtain consent before cloning a voice and disclose synthetic audio (card Limitations)."
  ],
  "schema_version": "1.1"
}
